biuro_nazwa;biuro_ogolem;biuro_WPF;biuro_pozostale;dzial_nazwa;dzial_WPF;dzial_pozostale;dzials_nazwa;dzials_WPF;dzials_pozostale;zadanie_num;zadanie_tresc;zadanie_WPF;zadanie_pozostale
"Wydział Gospodarki Komunalnej ";14.668.922;2.026.903;12.642.019;"400 Wytwarzanie i zaopatrywanie w energi elektryczn 0 ę ą , ";0;10.020.179;"40095 Pozostała działalno ść 0 ";0;10.020.179;2176711;"Termomodernizacja o ś wiatowych obiektów gminnych 0 ";0;10.000.000
"Wydział Gospodarki Komunalnej ";14.668.922;2.026.903;12.642.019;"400 Wytwarzanie i zaopatrywanie w energi elektryczn 0 ę ą , ";0;10.020.179;"40095 Pozostała działalno ść 0 ";0;10.020.179;2176731;"Zakup i monta Ŝ przeno ś nego kotła olejowego wraz ze 0 zbiornikiem na olej - algorytm";0;20.179
"Wydział Gospodarki Komunalnej ";14.668.922;2.026.903;12.642.019;"900 Gospodarka komunalna i ochrona ś rodowiska ";2.026.903;2.621.840;"90002 Gospodarka odpadami 0";726.903;0;2138241;"Gospodarka odpadami komunalnymi w Łodzi - faza II(kontynuacja zadania kod 2107441) 0";200.000;0
"Wydział Gospodarki Komunalnej ";14.668.922;2.026.903;12.642.019;"900 Gospodarka komunalna i ochrona ś rodowiska ";2.026.903;2.621.840;"90002 Gospodarka odpadami 0";726.903;0;2176321;"Odbieranie i zagospodarowanie odpadów komunalnych 0";50.000;0
"Wydział Gospodarki Komunalnej ";14.668.922;2.026.903;12.642.019;"900 Gospodarka komunalna i ochrona ś rodowiska ";2.026.903;2.621.840;"90002 Gospodarka odpadami 0";726.903;0;2176651;"Gospodarka odpadami komunalnymi w Łodzi - faza II - etapprzygotowawczy 0";476.903;0
"Wydział Gospodarki Komunalnej ";14.668.922;2.026.903;12.642.019;"900 Gospodarka komunalna i ochrona ś rodowiska ";2.026.903;2.621.840;"90015 O ś wietlenie ulic, placów i dróg 0 ";0;25.000;2176701;"Budowa o ś wietlenia skweru przy ul. Urz ę dniczej - algorytm 0 ";0;25.000
"Wydział Gospodarki Komunalnej ";14.668.922;2.026.903;12.642.019;"900 Gospodarka komunalna i ochrona ś rodowiska ";2.026.903;2.621.840;"90095 Pozostała działalno ść ";1.300.000;2.596.840;2176781;"Budowa i wyposa Ŝ enie placu zabaw dla dzieci oraz miejsc 0 integracji i spotka ń dla mieszka ń ców osiedla na terenie przy ul. Moskule 90 - algorytm i konkurs";0;242.300
"Wydział Gospodarki Komunalnej ";14.668.922;2.026.903;12.642.019;"900 Gospodarka komunalna i ochrona ś rodowiska ";2.026.903;2.621.840;"90095 Pozostała działalno ść ";1.300.000;2.596.840;2176791;"Budowa parkingu dla samochodów osobowych i autobusówprzy ul. Karpia 29-65 - algorytm i konkurs 0 ";0;500.000
"Wydział Gospodarki Komunalnej ";14.668.922;2.026.903;12.642.019;"900 Gospodarka komunalna i ochrona ś rodowiska ";2.026.903;2.621.840;"90095 Pozostała działalno ść ";1.300.000;2.596.840;2176801;"Budowa parkingu przy ul. Górnej i Okrzei - algorytm i konkurs 0 ";0;371.161
"Wydział Gospodarki Komunalnej ";14.668.922;2.026.903;12.642.019;"900 Gospodarka komunalna i ochrona ś rodowiska ";2.026.903;2.621.840;"90095 Pozostała działalno ść ";1.300.000;2.596.840;2176811;"Opracowanie dokumentacji technicznej na budow ę kanalizacji 0 deszczowej w ul. Stokowskiej od istn. ko ń cówki do ul. Junackiej wraz z utwardzeniem nawierzchni-algorytm";0;48.000
"Wydział Gospodarki Komunalnej ";14.668.922;2.026.903;12.642.019;"900 Gospodarka komunalna i ochrona ś rodowiska ";2.026.903;2.621.840;"90095 Pozostała działalno ść ";1.300.000;2.596.840;2176831;"Opracowanie dokumentacji technicznej na budow ę kanalizacji 0 deszczowej w ul. Brzezi ń skiej od ul. Pstrowskiego do ul. Marmurowej i do ul. Zjazdowej wraz z utwardzeniem ul.Beskidzkiej - algorytm";0;58.000
"Wydział Gospodarki Komunalnej ";14.668.922;2.026.903;12.642.019;"900 Gospodarka komunalna i ochrona ś rodowiska ";2.026.903;2.621.840;"90095 Pozostała działalno ść ";1.300.000;2.596.840;2176851;"Budowa parkingu dla cmentarza przy ulicy Poziomej -algorytm 0 ";0;60.000
"Wydział Gospodarki Komunalnej ";14.668.922;2.026.903;12.642.019;"900 Gospodarka komunalna i ochrona ś rodowiska ";2.026.903;2.621.840;"90095 Pozostała działalno ść ";1.300.000;2.596.840;2176861;"Budowa placu zabaw przy ulicach Denna-Pienista - algorytm 0 ";0;41.794
"Wydział Gospodarki Komunalnej ";14.668.922;2.026.903;12.642.019;"900 Gospodarka komunalna i ochrona ś rodowiska ";2.026.903;2.621.840;"90095 Pozostała działalno ść ";1.300.000;2.596.840;2176871;"Doposa Ŝ enie placu zabaw przy ul. Rydla 7b - algorytm 0 ";0;10.000
"Wydział Gospodarki Komunalnej ";14.668.922;2.026.903;12.642.019;"900 Gospodarka komunalna i ochrona ś rodowiska ";2.026.903;2.621.840;"90095 Pozostała działalno ść ";1.300.000;2.596.840;2176881;"Doposa Ŝ enie placu zabaw, remont ogrodzenia, o ś wietlenia i 0 innej infrastruktury technicznej oraz małej architektury przyul.Beskidzkiej 172 - algorytm";0;45.336
"Wydział Gospodarki Komunalnej ";14.668.922;2.026.903;12.642.019;"900 Gospodarka komunalna i ochrona ś rodowiska ";2.026.903;2.621.840;"90095 Pozostała działalno ść ";1.300.000;2.596.840;2188311;"Wykonanie projektu wraz z wykonaniem chodnika po stroniepołudniowej ci 0 ą gu pieszo-jezdnego od ul.Tuszy ń skiej do wjazdu przed blokiem przy ul.Rymanowskiej 5/7 - algorytm";0;20.000
"Wydział Gospodarki Komunalnej ";14.668.922;2.026.903;12.642.019;"900 Gospodarka komunalna i ochrona ś rodowiska ";2.026.903;2.621.840;"90095 Pozostała działalno ść ";1.300.000;2.596.840;2188481;"Inwestycje zwi ą zane z zaopatrzeniem w wod ę i 0 odprowadzaniem ś cieków dla miasta Łodzi";300.000;0
"Wydział Gospodarki Komunalnej ";14.668.922;2.026.903;12.642.019;"900 Gospodarka komunalna i ochrona ś rodowiska ";2.026.903;2.621.840;"90095 Pozostała działalno ść ";1.300.000;2.596.840;2188521;"Plac zabaw dla dzieci - Małe Smulsko. Lokalizacja w obr ę bie 0 P23: 103/13, 1756/5 - bud Ŝ et obywatelski";0;223.249
"Wydział Gospodarki Komunalnej ";14.668.922;2.026.903;12.642.019;"900 Gospodarka komunalna i ochrona ś rodowiska ";2.026.903;2.621.840;"90095 Pozostała działalno ść ";1.300.000;2.596.840;2188531;"Skatepark na Widzewie przy Lasku Widzewskim. Lokalizacja -działki 29/38, 29/28 (teren w południowej cz 0 ęś ci tzw. Lasu Widzewskiego) - bud Ŝ et obywatelski";0;850.000
"Wydział Gospodarki Komunalnej ";14.668.922;2.026.903;12.642.019;"900 Gospodarka komunalna i ochrona ś rodowiska ";2.026.903;2.621.840;"90095 Pozostała działalno ść ";1.300.000;2.596.840;2188541;"Park Osiedlowy. Lokalizacja - teren zielony mi ę dzy ul. 0 Ziemowita i ul. D ą brówki - bud Ŝ et obywatelski ";0;127.000
"Wydział Gospodarki Komunalnej ";14.668.922;2.026.903;12.642.019;"900 Gospodarka komunalna i ochrona ś rodowiska ";2.026.903;2.621.840;"90095 Pozostała działalno ść ";1.300.000;2.596.840;2188561;"System odwodnienia miasta 0";1.000.000;0
"Wydział Informatyki ";8.267.564;4.391.724;3.875.840;"720 Informatyka 0";1.522.724;0;"72095 Pozostała działalno ść 0";1.522.724;0;2161401;"e-Łód ź - II rozwój usług elektronicznych dla mieszka ń ców i 0 administracji Łodzi oraz rozbudowa sieci z uwzgl ę dnieniem szerokopasmowego dost ę pu do Internetu";1.522.724;0
"Wydział Informatyki ";8.267.564;4.391.724;3.875.840;"750 Administracja publiczna ";2.000.000;1.000.000;"75023 Urz ę dy gmin (miast i miast na prawach powiatu) ";2.000.000;1.000.000;2179221;"Utrzymanie, zakup i wymiana systemów informatycznych 0";2.000.000;0
"Wydział Informatyki ";8.267.564;4.391.724;3.875.840;"750 Administracja publiczna ";2.000.000;1.000.000;"75023 Urz ę dy gmin (miast i miast na prawach powiatu) ";2.000.000;1.000.000;2186881;"Zakup systemów do zarz ą dzania dokumentami, informacj ą i 0 finansami miasta - dokumentacja";0;1.000.000
"Wydział Informatyki ";8.267.564;4.391.724;3.875.840;"801 O ś wiata i wychowanie 0 ";0;2.875.840;"80195 Pozostała działalno ść 0 ";0;2.875.840;2186911;"Edukacyjne Wrota Regionu Łódzkiego 0 ";0;2.875.840
"Wydział Informatyki ";8.267.564;4.391.724;3.875.840;"900 Gospodarka komunalna i ochrona rodowiska ś 0";869.000;0;"90002 Gospodarka odpadami 0";869.000;0;2179211;"Zakup, modernizacja i utrzymanie platformy dotycz ą cej 0 ewidencji, naliczania i windykacji nale Ŝ no ś ci";869.000;0
"Wydział Kultury ";30.082.931;26.987.931;3.095.000;"750 Administracja publiczna 0";13.223;0;"75095 Pozostała działalno ść 0";13.223;0;2164411;"Łódzkie Przyjazne Filmowcom - zakupy inwestycyjne 0";13.223;0
"Wydział Kultury ";30.082.931;26.987.931;3.095.000;"921 Kultura i ochrona dziedzictwa narodowego ";26.974.708;3.095.000;"92106 Teatry 0";11.362.723;0;2144221;"Rewitalizacja i modernizacja Teatru Lalek Arlekin w Łodzi 0";8.162.723;0
"Wydział Kultury ";30.082.931;26.987.931;3.095.000;"921 Kultura i ochrona dziedzictwa narodowego ";26.974.708;3.095.000;"92106 Teatry 0";11.362.723;0;2164181;"Rewitalizacja i modernizacja Teatru Lalek ""Arlekin"" w Łodzi -wydatki nie obj 0 ę te umow ą o dofinansowanie projektu.";3.200.000;0
"Wydział Kultury ";30.082.931;26.987.931;3.095.000;"921 Kultura i ochrona dziedzictwa narodowego ";26.974.708;3.095.000;"92114 Pozostałe instytucje kultury 0";11.211.985;0;2144191;"Utworzenie w ramach Fabryki Sztuki w Łodzi InkubatoraKultury - Art._Inkubator 0";8.577.775;0
"Wydział Kultury ";30.082.931;26.987.931;3.095.000;"921 Kultura i ochrona dziedzictwa narodowego ";26.974.708;3.095.000;"92114 Pozostałe instytucje kultury 0";11.211.985;0;2144201;"Utworzenie w ramach Fabryki Sztuki w Łodzi InkubatoraKultury - Art._Inkubator - wydatki nie obj 0 ę te umow ą o dofinansowanie";2.634.210;0
"Wydział Kultury ";30.082.931;26.987.931;3.095.000;"921 Kultura i ochrona dziedzictwa narodowego ";26.974.708;3.095.000;"92116 Biblioteki 0 ";0;215.000;2187551;"Modernizacja filii nr 11 Miejskiej Biblioteki Publicznej Łód ź - 0 Bałuty przy ul. A.Radka 8";0;70.000
"Wydział Kultury ";30.082.931;26.987.931;3.095.000;"921 Kultura i ochrona dziedzictwa narodowego ";26.974.708;3.095.000;"92116 Biblioteki 0 ";0;215.000;2187771;"Modernizacja filii nr 7 Miejskiej Biblioteki Publicznej Łód ź -Bałuty 0 przy ul. Aleksandrowskiej 12";0;70.000
"Wydział Kultury ";30.082.931;26.987.931;3.095.000;"921 Kultura i ochrona dziedzictwa narodowego ";26.974.708;3.095.000;"92116 Biblioteki 0 ";0;215.000;2164391;"Likwidacja barier architektonicznych na potrzeby osóbniepełnosprawnych w filii nr 11 MBP Łód 0 ź Górna - algorytm";0;50.000
"Wydział Kultury ";30.082.931;26.987.931;3.095.000;"921 Kultura i ochrona dziedzictwa narodowego ";26.974.708;3.095.000;"92116 Biblioteki 0 ";0;215.000;2187701;"Komputeryzacja biblioteki na Stokach - bud Ŝ et obywatelski 0 ";0;25.000
"Wydział Kultury ";30.082.931;26.987.931;3.095.000;"921 Kultura i ochrona dziedzictwa narodowego ";26.974.708;3.095.000;"92118 Muzea 0 ";0;380.000;2187781;"Zakup muzealiów 0 ";0;300.000
"Wydział Kultury ";30.082.931;26.987.931;3.095.000;"921 Kultura i ochrona dziedzictwa narodowego ";26.974.708;3.095.000;"92118 Muzea 0 ";0;380.000;2187671;"Ocieplenie i klimatyzacja cz ęś ci wschodniej poddasza pałacu 0 Scheiblera. Adaptacja poddasza i ocieplenie stropu MuzeumKinematografii.";0;80.000
"Wydział Kultury ";30.082.931;26.987.931;3.095.000;"921 Kultura i ochrona dziedzictwa narodowego ";26.974.708;3.095.000;"92195 Pozostała działalno ść ";4.400.000;2.500.000;2164211;"Zintegrowany program rozwoju i przyj ę cia nowych funkcji dla 0 terenów Ksi ęŜ ego Młyna";4.400.000;0
"Wydział Kultury ";30.082.931;26.987.931;3.095.000;"921 Kultura i ochrona dziedzictwa narodowego ";26.974.708;3.095.000;"92195 Pozostała działalno ść ";4.400.000;2.500.000;2187751;"Modernizacja przestrzeni publicznej Osiedla Ksi ęŜ y Młyn 0 wraz z przebudow ą ulicy Ksi ęŜ y Młyn";0;2.500.000
"Wydział Maj ą tku Miasta 0 ";1.000.000;0;1.000.000;"700 Gospodarka mieszkaniowa 0 ";0;1.000.000;"70005 Gospodarka gruntami i nieruchomo ś ciami 0 ";0;1.000.000;2166301;"Zwrot ś rodków finansowych poniesionych na nakłady 0 budowlane wynikaj ą ce z przej ę tych nieruchomo ś ci";0;1.000.000
"Wydział Ochrony rodowiska i Rolnictwa 0 Ś";625.000;0;625.000;"900 Gospodarka komunalna i ochrona 0 ś rodowiska ";0;625.000;"90013 Schroniska dla zwierz ą t 0 ";0;625.000;2181121;"Poprawa warunków bytowych w łódzkim schronisku -bud 0 Ŝ et obywatelski";0;625.000
"Wydział Praw do Nieruchomo ś ci 0 ";2.391.542;0;2.391.542;"700 Gospodarka mieszkaniowa";0;2.391.542;"70005 Gospodarka gruntami i nieruchomo ś ciami 0 ";0;2.391.542;2174691;"Nabywanie nieruchomo ś ci 0 ";0;2.391.542
"Wydział Sportu ";11.377.500;2.500.000;8.877.500;"926 Kultura fizyczna ";2.500.000;8.877.500;"92601 Obiekty sportowe 0 ";0;850.000;2190031;"Modernizacja hali KS ""Gwardia"" Łód ź 0 ";0;700.000
"Wydział Sportu ";11.377.500;2.500.000;8.877.500;"926 Kultura fizyczna ";2.500.000;8.877.500;"92601 Obiekty sportowe 0 ";0;850.000;2190051;"Przygotowanie dokumentacji projektowej budowy CentrumSportu przy ulicy Północnej 0 ";0;150.000
"Wydział Sportu ";11.377.500;2.500.000;8.877.500;"926 Kultura fizyczna ";2.500.000;8.877.500;"92604 Instytucje kultury fizycznej ";2.500.000;8.027.500;2190021;"Dokumentacja projektowa na budow ę stadionu Ŝ u Ŝ lowego 0 przy ul. 6-go Sierpnia 71";0;1.000.000
"Wydział Sportu ";11.377.500;2.500.000;8.877.500;"926 Kultura fizyczna ";2.500.000;8.877.500;"92604 Instytucje kultury fizycznej ";2.500.000;8.027.500;2185151;"Zakup podłogi mobilnej do Hali Sportowej przy ul. Skorupki 0";21;700.000
"Wydział Sportu ";11.377.500;2.500.000;8.877.500;"926 Kultura fizyczna ";2.500.000;8.877.500;"92604 Instytucje kultury fizycznej ";2.500.000;8.027.500;2185161;"Modernizacja obiektu przy ul. Srebrzy ń skiej 0";95;550.000
"Wydział Sportu ";11.377.500;2.500.000;8.877.500;"926 Kultura fizyczna ";2.500.000;8.877.500;"92604 Instytucje kultury fizycznej ";2.500.000;8.027.500;2186711;"Modernizacja obiektu przy ul. Minerskiej 0";1.000.000;0
"Wydział Sportu ";11.377.500;2.500.000;8.877.500;"926 Kultura fizyczna ";2.500.000;8.877.500;"92604 Instytucje kultury fizycznej ";2.500.000;8.027.500;2186721;"Dostawa kontenerów szatniowych 0";250.000;0
"Wydział Sportu ";11.377.500;2.500.000;8.877.500;"926 Kultura fizyczna ";2.500.000;8.877.500;"92604 Instytucje kultury fizycznej ";2.500.000;8.027.500;2188121;"Modernizacja pływalni przy ul. Sobolowej 0 3.500.000";1;0
"Wydział Sportu ";11.377.500;2.500.000;8.877.500;"926 Kultura fizyczna ";2.500.000;8.877.500;"92604 Instytucje kultury fizycznej ";2.500.000;8.027.500;2189931;"Rozkwit Parku Stawy Jana - bud Ŝ et obywatelski 0 ";0;888.500
"Wydział Sportu ";11.377.500;2.500.000;8.877.500;"926 Kultura fizyczna ";2.500.000;8.877.500;"92604 Instytucje kultury fizycznej ";2.500.000;8.027.500;2189941;"Rozbudowa zaplecza socjalnego na lodowisku przy ul.Popiełuszki - bud 0 Ŝ et obywatelski";0;69.000
"Wydział Sportu ";11.377.500;2.500.000;8.877.500;"926 Kultura fizyczna ";2.500.000;8.877.500;"92604 Instytucje kultury fizycznej ";2.500.000;8.027.500;2189951;"Zakup sztucznej nawierzchni na lodowisku przy ul.Popiełuszki - bud 0 Ŝ et obywatelski";0;150.000
"Wydział Sportu ";11.377.500;2.500.000;8.877.500;"926 Kultura fizyczna ";2.500.000;8.877.500;"92604 Instytucje kultury fizycznej ";2.500.000;8.027.500;2189961;"Wymiana band na lodowisku przy ul. Popiełuszki - bud Ŝ et 0 obywatelski";0;280.000
"Wydział Sportu ";11.377.500;2.500.000;8.877.500;"926 Kultura fizyczna ";2.500.000;8.877.500;"92604 Instytucje kultury fizycznej ";2.500.000;8.027.500;2189991;"Modernizacja widowni w hali przy ul. Skorupki dla potrzebrozgrywek dzieci i młodzie 0 Ŝ y oraz przygotowanie dokumentacji projektowej przebudowy całej widowni daj ą cej mo Ŝ liwo ść organizacji imprez masowych";0;1.140.000
"Wydział Sportu ";11.377.500;2.500.000;8.877.500;"926 Kultura fizyczna ";2.500.000;8.877.500;"92604 Instytucje kultury fizycznej ";2.500.000;8.027.500;2190041;"Modernizacja obiektu rekreacyjno-wypoczynkowego ""StawyStefa 0 ń skiego""";0;1.000.000
"Wydział Zarz dzania Kryzysowego i 0 ą Bezpiecze ń stwa";2.592.258;0;2.592.258;"754 Bezpiecze ń stwo publiczne i ochrona 0 ";0;2.592.258;"75412 Ochotnicze stra Ŝ e po Ŝ arne 0 ";0;2.592.258;2179801;"Zakup sprz ę tu specjalistycznego dla OSP Sikawa w Łodzi ul. 0 Janosika 158 - algorytm";0;11.158
"Wydział Zarz dzania Kryzysowego i 0 ą Bezpiecze ń stwa";2.592.258;0;2.592.258;"754 Bezpiecze ń stwo publiczne i ochrona 0 ";0;2.592.258;"75412 Ochotnicze stra Ŝ e po Ŝ arne 0 ";0;2.592.258;2179841;"Budowa wjazdu z utwardzeniem cz ęś ci terenu na 0 nieruchomo ś ci przy ul. Plonowej 29/31 w OSP Mikołajew";0;50.000
"Wydział Zarz dzania Kryzysowego i 0 ą Bezpiecze ń stwa";2.592.258;0;2.592.258;"754 Bezpiecze ń stwo publiczne i ochrona 0 ";0;2.592.258;"75412 Ochotnicze stra Ŝ e po Ŝ arne 0 ";0;2.592.258;2179861;"Rozbudowa stra Ŝ nicy OSP Łód ź - Łaskowice 0 ";0;2.500.000
"Wydział Zarz dzania Kryzysowego i 0 ą Bezpiecze ń stwa";2.592.258;0;2.592.258;"754 Bezpiecze ń stwo publiczne i ochrona 0 ";0;2.592.258;"75412 Ochotnicze stra Ŝ e po Ŝ arne 0 ";0;2.592.258;2179981;"Doposa Ŝ enie jednostki OSP - Wiskitno, ul. Kolumny 312 - 0 bud Ŝ et obywatelski";0;31.100
"Wydział Zdrowia i Spraw Społecznych ";3.690.743;2.772.984;917.759;"851 Ochrona zdrowia ";2.772.984;917.759;"85111 Szpitale ogólne 0";2.772.984;0;2179651;"Dofinansowanie kompleksowej termomodernizacji obiektów ISzpitala Miejskiego im.dr E.Sonnenberga w Łodzi 0";772.984;0
"Wydział Zdrowia i Spraw Społecznych ";3.690.743;2.772.984;917.759;"851 Ochrona zdrowia ";2.772.984;917.759;"85111 Szpitale ogólne 0";2.772.984;0;2178901;"Prace budowlane w obiektach III Szpitala Miejskiego im. dr K.Jonschera w Łodzi 0";2.000.000;0
"Wydział Zdrowia i Spraw Społecznych ";3.690.743;2.772.984;917.759;"851 Ochrona zdrowia ";2.772.984;917.759;"85121 Lecznictwo ambulatoryjne 0 ";0;917.759;2186341;"Doposa Ŝ enie poradni neurologicznej poprzez zakup aparatu 0 do bada ń EEG w Miejskiej Przychodni ""D ą browa"" w Łodzi, przy ul. Feli ń skiego 7 - bud Ŝ et obywatelski";0;41.000
"Wydział Zdrowia i Spraw Społecznych ";3.690.743;2.772.984;917.759;"851 Ochrona zdrowia ";2.772.984;917.759;"85121 Lecznictwo ambulatoryjne 0 ";0;917.759;2186351;"Termomodernizacja budynku Miejskiej Przychodni""Tatrza 0 ń ska"" w Łodzi, przy ul. Tatrza ń skiej 109 - bud Ŝ et obywatelski Miejskie Centrum Zdrowia Publicznego im. Bł.R.Chyli 0 51.759";0;825.000
"Wydział Zdrowia i Spraw Społecznych ";3.690.743;2.772.984;917.759;"851 Ochrona zdrowia ";2.772.984;917.759;"85121 Lecznictwo ambulatoryjne 0 ";0;917.759;2186361;"Wymiana 10 szt. okien w Miejskim Centrum ZdrowiaPublicznego im. Bł. Rafała Chyli 0 ń skiego w Łodzi z siedzib ą przy ul. Niciarnianej 41 w Łodzi z przeznaczeniem dlaPrzychodni przy ul. Cieszkowskiego 6 w Łodzi - algorytm";0;51.759
"Zarz ą d Dróg i Transportu ";850.282.120;808.173.794;42.108.326;"600 Transport i ł ą czno ść ";807.087.653;39.923.463;"60015 Drogi publiczne w miastach na prawach powiatu (w ";805.987.653;32.575.492;2088702;"Dokumentacja projektowa na budow ę ul. Strykowskiej na odc. 0 od ul. Wycieczkowej do granicy miasta";200.000;0
"Zarz ą d Dróg i Transportu ";850.282.120;808.173.794;42.108.326;"600 Transport i ł ą czno ść ";807.087.653;39.923.463;"60015 Drogi publiczne w miastach na prawach powiatu (w ";805.987.653;32.575.492;2089742;"Dokumentacja projektowa na budow ę obwodnicy Nowosolnej 0 na odc. od ul. Iglastej do granic miasta i ł ą cznicy w ę zła ""Brzeziny"" na autostradzie A1, wraz z przebudow ą ul. Brzezi ń skiej na odc. od ul. projektowanej w rejonie CH ""M1"" do ul. Iglastej";500.000;0
"Zarz ą d Dróg i Transportu ";850.282.120;808.173.794;42.108.326;"600 Transport i ł ą czno ść ";807.087.653;39.923.463;"60015 Drogi publiczne w miastach na prawach powiatu (w ";805.987.653;32.575.492;2110982;"Budowa układu dróg rowerowych na terenie miasta 0";18.000.000;0
"Zarz ą d Dróg i Transportu ";850.282.120;808.173.794;42.108.326;"600 Transport i ł ą czno ść ";807.087.653;39.923.463;"60015 Drogi publiczne w miastach na prawach powiatu (w ";805.987.653;32.575.492;2111022;"Przebudowa ul. Rojnej na odc. od ul. Szczeci ń skiej do ul. 0 Traktorowej";22.000.000;0
"Zarz ą d Dróg i Transportu ";850.282.120;808.173.794;42.108.326;"600 Transport i ł ą czno ść ";807.087.653;39.923.463;"60015 Drogi publiczne w miastach na prawach powiatu (w ";805.987.653;32.575.492;2111072;"Budowa Drogi Krajowej Nr 1 ""Trasa Górna"" na odcinku od Al.Jana Pawła II do ul. Rzgowskiej Etap II odc. Paradna -Pabianicka 0";81.043.000;0
"Zarz ą d Dróg i Transportu ";850.282.120;808.173.794;42.108.326;"600 Transport i ł ą czno ść ";807.087.653;39.923.463;"60015 Drogi publiczne w miastach na prawach powiatu (w ";805.987.653;32.575.492;2111242;"Budowa trasy Górna na odc. Rzgowska – Paradna – etap I 0";54.399.999;0
"Zarz ą d Dróg i Transportu ";850.282.120;808.173.794;42.108.326;"600 Transport i ł ą czno ść ";807.087.653;39.923.463;"60015 Drogi publiczne w miastach na prawach powiatu (w ";805.987.653;32.575.492;2111272;"Przebudowa układu drogowego wokół MultimodalnegoDworca Łód 0 ź - Fabryczna";5.000.000;0
"Zarz ą d Dróg i Transportu ";850.282.120;808.173.794;42.108.326;"600 Transport i ł ą czno ść ";807.087.653;39.923.463;"60015 Drogi publiczne w miastach na prawach powiatu (w ";805.987.653;32.575.492;2111282;"Rozbudowa i modernizacja trasy tramwaju w relacji Wschód-Zachód (Retkinia-Olechów) wraz z systemem zasilania orazsystemem obszarowego sterowania ruchem 0";302.210.828;0
"Zarz ą d Dróg i Transportu ";850.282.120;808.173.794;42.108.326;"600 Transport i ł ą czno ść ";807.087.653;39.923.463;"60015 Drogi publiczne w miastach na prawach powiatu (w ";805.987.653;32.575.492;2111382;"Przebudowa ul. Kili ń skiego na odc. od ul. Narutowicza do 0 projektowanej ul. Ś l ą skiej - I etap (rejon ul. Piłsudskiego)";1.535.000;0
"Zarz ą d Dróg i Transportu ";850.282.120;808.173.794;42.108.326;"600 Transport i ł ą czno ść ";807.087.653;39.923.463;"60015 Drogi publiczne w miastach na prawach powiatu (w ";805.987.653;32.575.492;2111432;"Dokumentacja dotycz ą ca dróg stanowi ą cych dojazdy do 0 w ę złów na S 14";675.000;0
"Zarz ą d Dróg i Transportu ";850.282.120;808.173.794;42.108.326;"600 Transport i ł ą czno ść ";807.087.653;39.923.463;"60015 Drogi publiczne w miastach na prawach powiatu (w ";805.987.653;32.575.492;2129572;"Przebudowa układu drogowego wokół stadionu Łód ź Widzew 0";500.000;0
"Zarz ą d Dróg i Transportu ";850.282.120;808.173.794;42.108.326;"600 Transport i ł ą czno ść ";807.087.653;39.923.463;"60015 Drogi publiczne w miastach na prawach powiatu (w ";805.987.653;32.575.492;2129652;"W ę zeł Multimodalny przy Dworcu Łód ź - Fabryczna 0";208.118.482;0
"Zarz ą d Dróg i Transportu ";850.282.120;808.173.794;42.108.326;"600 Transport i ł ą czno ść ";807.087.653;39.923.463;"60015 Drogi publiczne w miastach na prawach powiatu (w ";805.987.653;32.575.492;2129662;"Program Nowe Centrum Łodzi-przebudowa infrastrukturywokół Dworca Łód 0 ź - Fabryczna";12.000.000;0
"Zarz ą d Dróg i Transportu ";850.282.120;808.173.794;42.108.326;"600 Transport i ł ą czno ść ";807.087.653;39.923.463;"60015 Drogi publiczne w miastach na prawach powiatu (w ";805.987.653;32.575.492;2129822;"Strategia rozwoju ul. Piotrkowskiej - przebudowa ul.Piotrkowskiej na odc. Al. Mickiewicza/Al. Piłsudskiego - PlacWolno 0 ś ci";30.520.000;0
"Zarz ą d Dróg i Transportu ";850.282.120;808.173.794;42.108.326;"600 Transport i ł ą czno ść ";807.087.653;39.923.463;"60015 Drogi publiczne w miastach na prawach powiatu (w ";805.987.653;32.575.492;2163052;"Rozbudowa ul. Ustronnej wraz z ul. Siostrzan ą 0";8.000.000;0
"Zarz ą d Dróg i Transportu ";850.282.120;808.173.794;42.108.326;"600 Transport i ł ą czno ść ";807.087.653;39.923.463;"60015 Drogi publiczne w miastach na prawach powiatu (w ";805.987.653;32.575.492;2163312;"Rozbudowa ul. Inflanckiej 0";31.550.000;0
"Zarz ą d Dróg i Transportu ";850.282.120;808.173.794;42.108.326;"600 Transport i ł ą czno ść ";807.087.653;39.923.463;"60015 Drogi publiczne w miastach na prawach powiatu (w ";805.987.653;32.575.492;2163492;"Dokumentacja na budow ę dróg - ekspertyzy, opinie i inne 0 opłaty";0;300.000
"Zarz ą d Dróg i Transportu ";850.282.120;808.173.794;42.108.326;"600 Transport i ł ą czno ść ";807.087.653;39.923.463;"60015 Drogi publiczne w miastach na prawach powiatu (w ";805.987.653;32.575.492;2163502;"Opłaty zwi ą zane z dokumentacj ą porealizacyjn ą oraz 0 rozliczeniami maj ą tkowymi z tytułu realizowanych inwestycji przez miasto";0;200.000
"Zarz ą d Dróg i Transportu ";850.282.120;808.173.794;42.108.326;"600 Transport i ł ą czno ść ";807.087.653;39.923.463;"60015 Drogi publiczne w miastach na prawach powiatu (w ";805.987.653;32.575.492;2163512;"Modernizacja ul. Armii Krajowej wraz z infrastruktur ą 0 towarzyszac ą na odcinku od ul. Kusoci ń skiego do ul. Marato ń skiej";0;2.800.000
"Zarz ą d Dróg i Transportu ";850.282.120;808.173.794;42.108.326;"600 Transport i ł ą czno ść ";807.087.653;39.923.463;"60015 Drogi publiczne w miastach na prawach powiatu (w ";805.987.653;32.575.492;2163542;"Przebudowa ulic po inwestycjach współfinansowanychprzez ISPA 0 ";0;20.000.000
"Zarz ą d Dróg i Transportu ";850.282.120;808.173.794;42.108.326;"600 Transport i ł ą czno ść ";807.087.653;39.923.463;"60015 Drogi publiczne w miastach na prawach powiatu (w ";805.987.653;32.575.492;2163572;"Budowa akomodowanych sygnalizacji ś wietlnych na terenie 0 miasta Łodzi wraz z niezb ę dn ą korekt ą układu drogowego - przej ś cie dla pieszych przy ul. Pomorskiej 437 - algorytm i konkurs";0;245.000
